{
  "$schema": "http://json-schema.org/draft-07/schema#",
  "title": "Signal",
  "type": "object",
  "required": ["signal_id","engine","pair","timeframe","timestamp","direction","confidence","sl","tp"],
  "properties": {
    "signal_id": {"type":"string"},
    "engine": {"type":"string"},
    "engine_version": {"type":["string","null"]},
    "pair": {"type":"string"},
    "timeframe": {"type":"string"},
    "timestamp": {"type":"string","format":"date-time"},
    "sent_at": {"type":"string","format":"date-time"},
    "executed_at": {"type":"string","format":"date-time"},
    "direction": {"type":"string","enum":["long","short"]},
    "confidence": {"type":"number","minimum":0,"maximum":1},
    "suggested_size": {"type":"number"},
    "execution_price": {"type":"number"},
    "execution_status": {"type":"string"},
    "sl": {"type":"number"},
    "tp": {"type":"number"},
    "explanation": {"type":"object"},
    "payload": {"type":"object"}
  },
  "additionalProperties": true
}
